,Unnamed: 0,id,author_id,text,retweets,permalink,date,formatted_date,favorites,mentions,hashtags,geo,urls,search_hashtags,location,text_clean,tb_sentiment_polarity,tb_sentiment_subjectivity,textBlob_sentiment,vader_compound,vader_pos,vader_neg,vader_neu,V_Sentiment
27707,27707,1.11163e+18,402320568.0,"@AOC I’m hoping the #GreenNewDeal includes getting industry leaders to set standards on packaging and other trash. @Apple is the worst! Besides wasteful packaging, there’s a new charger for everything! Everyone talks about diapers filling landfills. It’s chargers and cables!",0,https://twitter.com/EllisGBS/status/1111634499203448835,2019-03-29 14:21:32+00:00,Fri Mar 29 14:21:32 +0000 2019,0,@AOC @Apple,#GreenNewDeal,,,#greennewdeal,"Florida, USA",AOC I’m hoping the GreenNewDeal includes getting industry leaders to set standards on packaging and other trash Apple is the worst Besides wasteful packaging there’s a new charger for everything Everyone talks about diapers filling landfills It’s chargers and cables,-0.3295454545454545,0.6098484848484849,negative,-0.3182,0.064,0.09300000000000001,0.843,Negative
27718,27718,1.11127e+18,1.05e+18,Not a single @GOP brought up the past and future economic and human costs of not collaborating on the #GreenNewDeal . It’s an imperfect plan but to toss it out without working with #Dems on it is ignorant and selfish. #shameonyou! @AOC,0,https://twitter.com/IamMOI_NYCShoes/status/1111274782887215104,2019-03-28 14:32:09+00:00,Thu Mar 28 14:32:09 +0000 2019,0,@GOP @AOC,#GreenNewDeal #Dems #shameonyou,,,#greennewdeal,"Florida, USA",Not a single GOP brought up the past and future economic and human costs of not collaborating on the GreenNewDeal  It’s an imperfect plan but to toss it out without working with Dems on it is ignorant and selfish shameonyou AOC,-0.0857142857142857,0.3148809523809524,negative,-0.8151,0.0,0.18600000000000003,0.8140000000000001,Negative
27730,27730,1.11103e+18,1049171.0,What I really like about @AOC's ambuscade of the GOP on the #GreenNewDeal is that - even in losing - she gave the Republicans hell. We need to do more of this. More Bronx. Less polite clubbiness.,14,https://twitter.com/tomwatson/status/1111027419614507011,2019-03-27 22:09:13+00:00,Wed Mar 27 22:09:13 +0000 2019,58,@AOC,#GreenNewDeal,,,#greennewdeal,"Florida, USA",What I really like about AOCs ambuscade of the GOP on the GreenNewDeal is that  even in losing  she gave the Republicans hell We need to do more of this More Bronx Less polite clubbiness,0.2583333333333333,0.31666666666666665,positive,-0.6605,0.068,0.17600000000000002,0.7559999999999999,Negative
27738,27738,1.11097e+18,165067329.0,"It seems @AOC and her #GreenNewDeal got as much support in the Senate as......I really have no comparison. I can't believe an entire room of politicians agreed without disscent, that something stupid was stupid.",0,https://twitter.com/NYYanksBear/status/1110969410255286272,2019-03-27 18:18:42+00:00,Wed Mar 27 18:18:42 +0000 2019,0,@AOC,#GreenNewDeal,,,#greennewdeal,"Florida, USA",It seems AOC and her GreenNewDeal got as much support in the Senate as really have no comparison I cant believe an entire room of politicians agreed without disscent that something stupid was stupid,-0.23999999999999996,0.605,negative,-0.6682,0.114,0.221,0.665,Negative
27739,27739,1.11097e+18,9.23e+17,"@RCamposDuffy @AOC AOC, the children in the south Bronx have a higher asthma rate because of their LIVING CONDITIONS! They live in apartments infected with MOLD! How about you start worrying about things that will ACTUALLY HELP CHILDREN????? #GreenNewDeal",0,https://twitter.com/lillysmithstee1/status/1110968977034014725,2019-03-27 18:16:59+00:00,Wed Mar 27 18:16:59 +0000 2019,0,@RCamposDuffy @AOC,#GreenNewDeal,,,#greennewdeal,"Florida, USA",RCamposDuffy AOC AOC the children in the south Bronx have a higher asthma rate because of their LIVING CONDITIONS They live in apartments infected with MOLD How about you start worrying about things that will ACTUALLY HELP CHILDREN GreenNewDeal,0.12878787878787878,0.3666666666666667,positive,-0.2885,0.078,0.127,0.795,Negative
27754,27754,1.1109e+18,9.89e+17,Women are strong as hell @AOC #womenareamazing #GreenNewDeal #ClimateChange,2,https://twitter.com/FancyAcademic/status/1110897861225562112,2019-03-27 13:34:24+00:00,Wed Mar 27 13:34:24 +0000 2019,2,@AOC,#womenareamazing #GreenNewDeal #ClimateChange,,https://twitter.com/guardian/status/1110854289579216897,#greennewdeal,"Florida, USA",Women are strong as hell AOC womenareamazing GreenNewDeal ClimateChange,0.4333333333333333,0.7333333333333333,positive,-0.3182,0.221,0.309,0.47,Negative
27811,27811,1.1098e+18,9.75e+17,.@FoxNews is in no way obsessed with @AOC. Nothing creepy here. #SundayMorning #aoc #GreenNewDeal ,0,https://twitter.com/theBradChadford/status/1109801234444230658,2019-03-24 12:56:48+00:00,Sun Mar 24 12:56:48 +0000 2019,0,@FoxNews @AOC,#SundayMorning #aoc #GreenNewDeal,,,#greennewdeal,"Florida, USA",FoxNews is in no way obsessed with AOC Nothing creepy here SundayMorning aoc GreenNewDeal ,-0.5,1.0,negative,-0.4404,0.0,0.245,0.755,Negative
27813,27813,1.10947e+18,15403199.0,Hey @AOC when you attack Israel here is one think you should know Israel is #1 in worldwide water recycling — at 85%. Spain is #2 — at only 17%. Maybe you should visit and see all other #GreenNewDeal ideas they have implemented.,0,https://twitter.com/laweiner/status/1109468786212720641,2019-03-23 14:55:46+00:00,Sat Mar 23 14:55:46 +0000 2019,0,@AOC,#GreenNewDeal,,,#greennewdeal,"Florida, USA",Hey AOC when you attack Israel here is one think you should know Israel is 1 in worldwide water recycling — at 85 Spain is 2 — at only 17 Maybe you should visit and see all other GreenNewDeal ideas they have implemented,-0.0625,0.6875,negative,-0.4767,0.0,0.075,0.925,Negative
27838,27838,1.10815e+18,1195739227.0,A disastrous segment by one of the leaders of the #FailedBanks back in 2008. Why is he still relevant? We know we need #GreenNewDeal and we know #Bernie2020 will bring it with @AOC @AyannaPressley @IlhanMN etc!,0,https://twitter.com/mathemactivist/status/1108147049621528576,2019-03-19 23:23:39+00:00,Tue Mar 19 23:23:39 +0000 2019,0,@AOC @AyannaPressley @IlhanMN,#FailedBanks #GreenNewDeal #Bernie2020,,https://twitter.com/justicedems/status/1108090034736058368,#greennewdeal,"Florida, USA",A disastrous segment by one of the leaders of the FailedBanks back in 2008 Why is he still relevant We know we need GreenNewDeal and we know Bernie2020 will bring it with AOC AyannaPressley IlhanMN etc,-0.09999999999999998,0.5666666666666668,negative,-0.5994,0.0,0.10300000000000001,0.897,Negative
27843,27843,1.10764e+18,424274008.0,".@AnaChezaNYC Founder CEO Njeri Mathu tells #WallStreetGreenSummit @AOC #GreenNewDeal is “flawed and controversial, but iterative” a first step, a start #Millennials #ClimateChange #GlobalRecyclingDay – at The Princeton Club of New York",2,https://twitter.com/USEnergyAssn/status/1107640089340010497,2019-03-18 13:49:10+00:00,Mon Mar 18 13:49:10 +0000 2019,4,@AnaChezaNYC @AOC,#WallStreetGreenSummit #GreenNewDeal #Millennials #ClimateChange #GlobalRecyclingDay,,,#greennewdeal,"Florida, USA",AnaChezaNYC Founder CEO Njeri Mathu tells WallStreetGreenSummit AOC GreenNewDeal is “flawed and controversial but iterative” a first step a start Millennials ClimateChange GlobalRecyclingDay – at The Princeton Club of New York,0.1090909090909091,0.5594696969696971,positive,-0.1027,0.0,0.049,0.951,Negative
27849,27849,1.10731e+18,1.1e+18,"Eat shit , you guys are the lowest of the low. You spread hate and bullshit when ever you can. You make fun of a war hero after he is dead. @RepAOC @AOC @cenkuygur @SarahSmith4WA are working to make the USA a better place. #GreenNewDeal #GND #MedicareForAll #SundayMotivation",2,https://twitter.com/JesseD05553458/status/1107314735848931328,2019-03-17 16:16:20+00:00,Sun Mar 17 16:16:20 +0000 2019,6,@RepAOC @AOC @cenkuygur @SarahSmith4WA,#GreenNewDeal #GND #MedicareForAll #SundayMotivation,,,#greennewdeal,"Florida, USA",Eat shit  you guys are the lowest of the low You spread hate and bullshit when ever you can You make fun of a war hero after he is dead RepAOC AOC cenkuygur SarahSmith4WA are working to make the USA a better place GreenNewDeal GND MedicareForAll SundayMotivation,-0.06666666666666665,0.5166666666666667,negative,-0.9349,0.142,0.349,0.509,Negative
27885,27885,1.10547e+18,18144320.0,"Perhaps revolutions are not the train ride, but the human race grabbing for the emergency brake.-- Walter Benjamin. #GreenNewDeal @AOC",0,https://twitter.com/kc2pgo/status/1105472271420977152,2019-03-12 14:15:02+00:00,Tue Mar 12 14:15:02 +0000 2019,0,@AOC,#GreenNewDeal,,,#greennewdeal,"Florida, USA",Perhaps revolutions are not the train ride but the human race grabbing for the emergency brake Walter Benjamin GreenNewDeal AOC,0.0,0.1,positive,-0.5267,0.0,0.152,0.848,Negative
27912,27912,1.09665e+18,21450053.0,#CryinChuckSchumer selectively outraged yet again! Wuz it cuz he gotta go on record in support of Z #GreenNewDeal? perhaps #Fartingcows or his election-cycle immigration policy? Either way he's #mitch'sbitch As @AOC parties the night away havin killed 25K new jobs #watajoke not,0,https://twitter.com/ChefJayisin/status/1096648860393504774,2019-02-16 05:53:57+00:00,Sat Feb 16 05:53:57 +0000 2019,0,@AOC,#CryinChuckSchumer #GreenNewDeal #Fartingcows #mitch #watajoke,,,#greennewdeal,"Florida, USA",CryinChuckSchumer selectively outraged yet again Wuz it cuz he gotta go on record in support of Z GreenNewDeal perhaps Fartingcows or his electioncycle immigration policy Either way hes mitchsbitch As AOC parties the night away havin killed 25K new jobs watajoke not,-0.3212121212121212,0.4848484848484849,negative,-0.5574,0.107,0.159,0.7340000000000001,Negative
29087,29087,1.14833e+18,930989606.0,"Proud of my Congressman @repblumenauer for joining with @AOC and @SenSanders in drafting a resolution on the climate crisis. I was visiting family in Philly, Bucks County, and the Pocono Mountains this week and have been unnerved by the extreme heat &amp; humidity. #ClimateCrisis ",0,https://twitter.com/RobAmerman/status/1148334989412589569,2019-07-08 20:56:11+00:00,Mon Jul 08 20:56:11 +0000 2019,0,@repblumenauer @AOC @SenSanders,#ClimateCrisis,,https://twitter.com/KtreeThomas/status/1148305620099092480,#climatecrisis,"Florida, USA",Proud of my Congressman repblumenauer for joining with AOC and SenSanders in drafting a resolution on the climate crisis I was visiting family in Philly Bucks County and the Pocono Mountains this week and have been unnerved by the extreme heat amp humidity ClimateCrisis ,0.3375,1.0,positive,-0.25,0.066,0.087,0.847,Negative
29194,29194,1.14136e+18,28327349.0,@PeteButtigieg @JoeBiden @ewarren @KamalaHarris @JayInslee @CoryBooker @amyklobuchar Have you seen this headline? “Trump rolls back only rule that curbs coal-fired power plant pollution.” Take a strong stand on this criminal act! #ClimateCrisis #ClimateAction @AOC,0,https://twitter.com/prizzotweet/status/1141359056218677248,2019-06-19 14:56:19+00:00,Wed Jun 19 14:56:19 +0000 2019,0,@PeteButtigieg @JoeBiden @ewarren @KamalaHarris @JayInslee @CoryBooker @amyklobuchar @AOC,#ClimateCrisis #ClimateAction,,,#climatecrisis,"Florida, USA",PeteButtigieg JoeBiden ewarren KamalaHarris JayInslee CoryBooker amyklobuchar Have you seen this headline “Trump rolls back only rule that curbs coalfired power plant pollution” Take a strong stand on this criminal act ClimateCrisis ClimateAction AOC,0.00833333333333332,0.5708333333333333,positive,-0.1779,0.086,0.10400000000000001,0.809,Negative
31346,31346,1.14136e+18,28327349.0,@PeteButtigieg @JoeBiden @ewarren @KamalaHarris @JayInslee @CoryBooker @amyklobuchar Have you seen this headline? “Trump rolls back only rule that curbs coal-fired power plant pollution.” Take a strong stand on this criminal act! #ClimateCrisis #ClimateAction @AOC,0,https://twitter.com/prizzotweet/status/1141359056218677248,2019-06-19 14:56:19+00:00,Wed Jun 19 14:56:19 +0000 2019,0,@PeteButtigieg @JoeBiden @ewarren @KamalaHarris @JayInslee @CoryBooker @amyklobuchar @AOC,#ClimateCrisis #ClimateAction,,,#climateaction,"Florida, USA",PeteButtigieg JoeBiden ewarren KamalaHarris JayInslee CoryBooker amyklobuchar Have you seen this headline “Trump rolls back only rule that curbs coalfired power plant pollution” Take a strong stand on this criminal act ClimateCrisis ClimateAction AOC,0.00833333333333332,0.5708333333333333,positive,-0.1779,0.086,0.10400000000000001,0.809,Negative
32210,32210,1.12876e+18,39877369.0,"@SecBernhardt While you are sleeping on the job, the rest of the world IS LOSING SLEEP! #FridaysForFuture We are extremely concerned about hitting 415ppm carbon dioxide-sea level rise! @RepCartwright @NRDC @JayInslee @ewarren @BernieSanders @AOC @sunrisemvmt #ExtinctionRebellion",0,https://twitter.com/MuguetteNY/status/1128759844108939265,2019-05-15 20:31:32+00:00,Wed May 15 20:31:32 +0000 2019,0,@SecBernhardt @RepCartwright @NRDC @JayInslee @ewarren @BernieSanders @AOC @sunrisemvmt,#FridaysForFuture #ExtinctionRebellion,,https://twitter.com/NRDC/status/1128750138267246593,#fridaysforfuture,"Florida, USA",SecBernhardt While you are sleeping on the job the rest of the world IS LOSING SLEEP FridaysForFuture We are extremely concerned about hitting 415ppm carbon dioxidesea level rise RepCartwright NRDC JayInslee ewarren BernieSanders AOC sunrisemvmt ExtinctionRebellion,-0.125,1.0,negative,-0.516,0.0,0.087,0.9129999999999999,Negative
36067,36067,1.1211e+18,16247751.0,"#HumanityIsFading, The World Is Crying And Nobody Is Listening. Let’s make a Global commitment or #Countdown2Extinction. It’s All or Nothing. We still have time. Make changes and #JustSayHola. #humanity #oceans #land #air #timcook #sustainability #earthday #ItsAllOrNothing @AOC",4,https://twitter.com/angellight/status/1121101897707020296,2019-04-24 17:21:36+00:00,Wed Apr 24 17:21:36 +0000 2019,3,@AOC,#HumanityIsFading #Countdown2Extinction #JustSayHola #humanity #oceans #land #air #timcook #sustainability #earthday #earthday #ItsAllOrNothing,,,#sustainability,"Florida, USA",HumanityIsFading The World Is Crying And Nobody Is Listening Let’s make a Global commitment or Countdown2Extinction It’s All or Nothing We still have time Make changes and JustSayHola humanity oceans land air timcook sustainability earthday ItsAllOrNothing AOC,-0.1,0.3,negative,-0.128,0.065,0.078,0.856,Negative
40931,40931,1.11456e+18,5609882.0,"¿Y por qué en México no tenemos a alguien como @AOC ? Oye @Claudiashein eres Dra. y científica : ¿Por qué apoyas las movilidades clasistas, contaminantes y que generan mayor numero de niños muertos ? Ayuda @Javier_Hidalgo @mijisoficial #CambioClimatico #ClimateStrike ",4,https://twitter.com/sansansan/status/1114563047358705664,2019-04-06 16:18:32+00:00,Sat Apr 06 16:18:32 +0000 2019,9,@AOC @Claudiashein @Javier_Hidalgo @mijisoficial,#CambioClimatico #ClimateStrike,,https://twitter.com/BLeeForCongress/status/1114280300505378816,#climatestrike,"Mexico, Mexico",¿Y por qué en México no tenemos a alguien como AOC  Oye Claudiashein eres Dra y científica  ¿Por qué apoyas las movilidades clasistas contaminantes y que generan mayor numero de niños muertos  Ayuda JavierHidalgo mijisoficial CambioClimatico ClimateStrike ,0.0,0.0,positive,-0.29600000000000004,0.0,0.062,0.937,Negative
41101,41101,1.11456e+18,5609882.0,"¿Y por qué en México no tenemos a alguien como @AOC ? Oye @Claudiashein eres Dra. y científica : ¿Por qué apoyas las movilidades clasistas, contaminantes y que generan mayor numero de niños muertos ? Ayuda @Javier_Hidalgo @mijisoficial #CambioClimatico #ClimateStrike ",4,https://twitter.com/sansansan/status/1114563047358705664,2019-04-06 16:18:32+00:00,Sat Apr 06 16:18:32 +0000 2019,9,@AOC @Claudiashein @Javier_Hidalgo @mijisoficial,#CambioClimatico #ClimateStrike,,https://twitter.com/BLeeForCongress/status/1114280300505378816,#climatestrike,"Mexico, Mexico",¿Y por qué en México no tenemos a alguien como AOC  Oye Claudiashein eres Dra y científica  ¿Por qué apoyas las movilidades clasistas contaminantes y que generan mayor numero de niños muertos  Ayuda JavierHidalgo mijisoficial CambioClimatico ClimateStrike ,0.0,0.0,positive,-0.29600000000000004,0.0,0.062,0.937,Negative
41307,41307,1.11492e+18,5609882.0,¿Dr. Qué opina sobre el “Green New Deal” de @AOC y la amenaza del #CambioClimatico mientras en México seguimos políticas energéticas ecocidas y no se habla de #ClimateChange ni #strike4climate y la 4T está siguiendo la misma política energética de #Trump @realDonaldTrump?,0,https://twitter.com/sansansan/status/1114919957790318593,2019-04-07 15:56:46+00:00,Sun Apr 07 15:56:46 +0000 2019,0,@AOC @realDonaldTrump,#CambioClimatico #ClimateChange #strike4climate #Trump,,,#climatechange,"Mexico, Mexico",¿Dr Qué opina sobre el “Green New Deal” de AOC y la amenaza del CambioClimatico mientras en México seguimos políticas energéticas ecocidas y no se habla de ClimateChange ni strike4climate y la 4T está siguiendo la misma política energética de Trump realDonaldTrump,-0.03181818181818183,0.3772727272727273,negative,-0.29600000000000004,0.0,0.055,0.945,Negative
43449,43449,1.15091e+18,8.4e+17,"@AOC / @RepAOC and her 3 tails ( @Ilhan / @IlhanMN, @RashidaTlaib &amp; @AyannaPressley ) America has seen your Mad Policies since you (4) enter into the Congress. Mad #GreenNewDeal Anti-Semitism Pro Al- Qaeda, Pro Hezballah Detention centers are not Concentration camps – at A. S. Rao Nagar",1,https://twitter.com/KNReddy_WB_FDA/status/1150912443482116099,2019-07-15 23:38:04+00:00,Mon Jul 15 23:38:04 +0000 2019,1,@AOC @RepAOC @Ilhan @IlhanMN @RashidaTlaib @AyannaPressley,#GreenNewDeal,,,#greennewdeal,"Mumbai, India",AOC  RepAOC and her 3 tails  Ilhan  IlhanMN RashidaTlaib amp AyannaPressley  America has seen your Mad Policies since you 4 enter into the Congress Mad GreenNewDeal AntiSemitism Pro Al Qaeda Pro Hezballah Detention centers are not Concentration camps – at A S Rao Nagar,-0.625,1.0,negative,-0.836,0.0,0.198,0.802,Negative
43450,43450,1.15091e+18,8.4e+17,"@AOC / @RepAOC and her 3 tails ( @Ilhan / @IlhanMN, @RashidaTlaib &amp; @AyannaPressley ) America has seen your Mad Policies since you (4) enter into the Congress. Mad #GreenNewDeal Anti-Semitism Pro Al- Qaeda, Pro Hezballah Detention centers are not Concentration camps – at A. S. Rao Nagar",0,https://twitter.com/KNReddy_WB_FDA/status/1150910816121573376,2019-07-15 23:31:36+00:00,Mon Jul 15 23:31:36 +0000 2019,0,@AOC @RepAOC @Ilhan @IlhanMN @RashidaTlaib @AyannaPressley,#GreenNewDeal,,,#greennewdeal,"Mumbai, India",AOC  RepAOC and her 3 tails  Ilhan  IlhanMN RashidaTlaib amp AyannaPressley  America has seen your Mad Policies since you 4 enter into the Congress Mad GreenNewDeal AntiSemitism Pro Al Qaeda Pro Hezballah Detention centers are not Concentration camps – at A S Rao Nagar,-0.625,1.0,negative,-0.836,0.0,0.198,0.802,Negative
43452,43452,1.14933e+18,8.4e+17,"It's % true Mandy. Far Left Democrats @AOC and @BernieSanders literally trying to create a Manufacturing crisis for Americans. #GreenNewDeal is a disasterous $100 Trillion deal, which makes millions of American jobs lost and Manufacturing companies going to shut down in US – at A. S. Rao Nagar",1,https://twitter.com/KNReddy_WB_FDA/status/1149333974054920192,2019-07-11 15:05:47+00:00,Thu Jul 11 15:05:47 +0000 2019,2,@AOC @BernieSanders,#GreenNewDeal,,,#greennewdeal,"Mumbai, India",Its  true Mandy Far Left Democrats AOC and BernieSanders literally trying to create a Manufacturing crisis for Americans GreenNewDeal is a disasterous 100 Trillion deal which makes millions of American jobs lost and Manufacturing companies going to shut down in US – at A S Rao Nagar,0.05888888888888887,0.3877777777777778,positive,-0.3612,0.099,0.13,0.7709999999999999,Negative
43453,43453,1.13917e+18,8.4e+17,"Is @SenSanders ever gained minimum percentage of American Voters in any Presidential election? No Is @AOC proposal of #GreenNewDeal ($100 Trillion) ever get passed by the Congress? No Then why should we bother about their socialist ideoloagy? USSR, Cuba &amp; Venezuela ",1,https://twitter.com/KNReddy_WB_FDA/status/1139172701132677120,2019-06-13 14:08:31+00:00,Thu Jun 13 14:08:31 +0000 2019,1,@SenSanders @AOC,#GreenNewDeal,,,#greennewdeal,"Mumbai, India",Is SenSanders ever gained minimum percentage of American Voters in any Presidential election No Is AOC proposal of GreenNewDeal 100 Trillion ever get passed by the Congress No Then why should we bother about their socialist ideoloagy USSR Cuba amp Venezuela ,0.0,0.0,positive,-0.4939,0.055999999999999994,0.147,0.797,Negative
46138,46138,1.12378e+18,156742406.0,"#socialism #GreenNewDeal (Pt. 1) Too bad we can’t all objectively look at the Green New Deal as presented originally, and then after its revisions, since it is essentially the whole agenda for whatever you want to call the political persuasion of those whom @AOC represents....",0,https://twitter.com/globalrolf/status/1123784190300971012,2019-05-02 03:00:04+00:00,Thu May 02 03:00:04 +0000 2019,0,@AOC,#socialism #GreenNewDeal,,,#greennewdeal,"NewYork, USA",socialism GreenNewDeal Pt 1 Too bad we can’t all objectively look at the Green New Deal as presented originally and then after its revisions since it is essentially the whole agenda for whatever you want to call the political persuasion of those whom AOC represents,-0.023579545454545443,0.3839015151515152,negative,-0.4939,0.027999999999999997,0.075,0.897,Negative
46147,46147,1.11239e+18,27955550.0,Hey @AOC! Look what I got early! Continue to fight for us! #GreenNewDeal ,0,https://twitter.com/omahajon/status/1112389566076514305,2019-03-31 16:21:54+00:00,Sun Mar 31 16:21:54 +0000 2019,1,@AOC,#GreenNewDeal,,,#greennewdeal,"NewYork, USA",Hey AOC Look what I got early Continue to fight for us GreenNewDeal ,0.1,0.3,positive,-0.3818,0.0,0.191,0.809,Negative
46902,46902,1.11098e+18,74536284.0, You tell‘ em girl @AOC but not just a national problem...it’s a global problem! #climatestrike #climatechange #noplanetb,0,https://twitter.com/hollyniemela/status/1110977046849691653,2019-03-27 18:49:03+00:00,Wed Mar 27 18:49:03 +0000 2019,1,@AOC,#climatestrike #climatechange #noplanetb,,https://twitter.com/briantylercohen/status/1110700996282343424,#climatestrike,"Paris, France", You tell‘ em girl AOC but not just a national problem’s a global problem climatestrike climatechange noplanetb,0.0,0.0,positive,-0.5499,0.0,0.20199999999999999,0.7979999999999999,Negative
47598,47598,1.11098e+18,74536284.0, You tell‘ em girl @AOC but not just a national problem...it’s a global problem! #climatestrike #climatechange #noplanetb,0,https://twitter.com/hollyniemela/status/1110977046849691653,2019-03-27 18:49:03+00:00,Wed Mar 27 18:49:03 +0000 2019,1,@AOC,#climatestrike #climatechange #noplanetb,,https://twitter.com/briantylercohen/status/1110700996282343424,#climatestrike,"Paris, France", You tell‘ em girl AOC but not just a national problem’s a global problem climatestrike climatechange noplanetb,0.0,0.0,positive,-0.5499,0.0,0.20199999999999999,0.7979999999999999,Negative
48139,48139,1.1882e+18,38745745.0,"A voir. En 1982, les prévisions on ne peut plus précises d'Exxon pour 2019 : 415ppm de CO2 dans l'atmosphère et 1⁰C de hausse de la température moyenne. Et leur criminelle organisation du ""doute"". @AOC @ExxonMobil_FRA @exxonmobil #climatechange #doubt",0,https://twitter.com/alexiskryceve/status/1188201624436723712,2019-10-26 21:11:57+00:00,Sat Oct 26 21:11:57 +0000 2019,1,@AOC @ExxonMobil_FRA @exxonmobil,#climatechange #doubt,,https://twitter.com/Independent/status/1187719206562910209,#climatechange,"Paris, France",A voir En 1982 les prévisions on ne peut plus précises dExxon pour 2019  415ppm de CO2 dans latmosphère et 1⁰C de hausse de la température moyenne Et leur criminelle organisation du doute AOC ExxonMobilFRA exxonmobil climatechange doubt,0.0,0.0,positive,-0.3612,0.0,0.065,0.935,Negative
49133,49133,1.11098e+18,74536284.0, You tell‘ em girl @AOC but not just a national problem...it’s a global problem! #climatestrike #climatechange #noplanetb,0,https://twitter.com/hollyniemela/status/1110977046849691653,2019-03-27 18:49:03+00:00,Wed Mar 27 18:49:03 +0000 2019,1,@AOC,#climatestrike #climatechange #noplanetb,,https://twitter.com/briantylercohen/status/1110700996282343424,#climatechange,"Paris, France", You tell‘ em girl AOC but not just a national problem’s a global problem climatestrike climatechange noplanetb,0.0,0.0,positive,-0.5499,0.0,0.20199999999999999,0.7979999999999999,Negative
49430,49430,1.18432e+18,2521826203.0,"«No hay medios caminos ante el #CambioClimático, o enfrentamos realmente el problema conforme con el consenso científico, o no lo lograremos» @AOC #GreenNewDeal #ClimateEmergency #EcologicalEmergency @JuventudXClima @JuventudXClima @IETD_MX @PUEDUNAM",1,https://twitter.com/CeibaOficial/status/1184324510591475712,2019-10-16 04:25:41+00:00,Wed Oct 16 04:25:41 +0000 2019,2,@AOC @JuventudXClima @JuventudXClima @IETD_MX @PUEDUNAM,#CambioClim #GreenNewDeal #ClimateEmergency #EcologicalEmergency,,,#greennewdeal,"Paris, France",«No hay medios caminos ante el CambioClimático o enfrentamos realmente el problema conforme con el consenso científico o no lo lograremos» AOC GreenNewDeal ClimateEmergency EcologicalEmergency JuventudXClima JuventudXClima IETDMX PUEDUNAM,0.0,0.0,positive,-0.29600000000000004,0.0,0.078,0.922,Negative
